{
  "schema_version": 1,
  "id": "evidence.demo.step",
  "book_id": "book.demo",
  "chapter": "明确下一步",
  "source_path": "sources/demo.md",
  "source_sha256": "76e07ec8a18615def9d7587d2db4aabc0ed78c1e7bb4c0abb5dc41ca7a6329fc",
  "start": 64,
  "end": 122,
  "text": "面对模糊的任务，先写出一个能实际执行且能判断是否完成的小步骤。例如，把“整理资料”改为“列出今天要处理的三个文件”。"
}
